link,title,description
http://arxiv.org/abs/2102.06564, Discrete-Time Consensus Networks: Scalability  Grounding and  Countermeasures,We investigate the disruption of discrete-time consensus problems viagrounding. Loosely speaking  grounding a network occurs if the state of oneagent no longer responds to inputs from other agents and/or changes itsdynamics. Then  the agent becomes a leader or a so-called stubborn agent. Thedisruption of the agent can be caused by internal faults  safety protocols ordue to an external malicious attack. In this paper we investigate how groundingaffects expander graph families that usually exhibit good scaling propertieswith increasing network size. It is shown that the algebraic connectivity andeigenratio of the network decrease due to the grounding causing the performanceand scalability of the network to deteriorate  even to the point of losingconsensusability. We then present possible countermeasures to such disruptionsand discuss their practicality and limitations. In particular  for a specificcountermeasure of deliberately grounding additional nodes  we investigateextensively how to select additional nodes to ground and how many nodes we needto ground to recover the consensus performance. Our findings are supported by awide range of numerical simulations.
http://arxiv.org/abs/2102.06565, An Overview of Recommender Systems and Machine Learning in Feature  Modeling and Configuration,Recommender systems support decisions in various domains ranging from simpleitems such as books and movies to more complex items such as financialservices  telecommunication equipment  and software systems. In this context recommendations are determined  for example  on the basis of analyzing thepreferences of similar users. In contrast to simple items which can beenumerated in an item catalog  complex items have to be represented on thebasis of variability models (e.g.  feature models) since a complete enumerationof all possible configurations is infeasible and would trigger significantperformance issues. In this paper  we give an overview of a potential new lineof research which is related to the application of recommender systems andmachine learning techniques in feature modeling and configuration. In thiscontext  we give examples of the application of recommender systems and machinelearning and discuss future research issues.
http://arxiv.org/abs/2102.06570, ReLU Neural Networks for Exact Maximum Flow Computation,Understanding the great empirical success of artificial neural networks (NNs)from a theoretical point of view is currently one of the hottest researchtopics in computer science. In this paper we study the expressive power of NNswith rectified linear units from a combinatorial optimization perspective. Inparticular  we show that  given a directed graph with  n  nodes and  m  arcs there exists an NN of polynomial size that computes a maximum flow from anypossible real-valued arc capacities as input. To prove this  we develop thepseudo-code language Max-Affine Arithmetic Programs (MAAPs) and showequivalence between MAAPs and NNs concerning natural complexity measures. Wethen design a MAAP to exactly solve the Maximum Flow Problem  which translatesto an NN of size  \mathcal{O}(m^2 n^2) .
http://arxiv.org/abs/2102.06571, UAVs Path Deviation Attacks: Survey and Research Challenges,Recently  Unmanned Aerial Vehicles (UAVs) are employed for a plethora ofcivilian applications. Such flying vehicles can accomplish tasks under thepilot's eyesight within the range of a remote controller  or autonomouslyaccording to a certain pre-loaded path configuration. Different path deviationattacks can be performed by malicious users against UAVs. We classify suchattacks and the relative defenses based on the UAV's flight mode  i.e.  (i)First Person View (FPV)  (ii) civilian Global Navigation Satellite System based(GNSS)  and (iii) GNSS  plus  auxiliary technologies (GNSS+)  and on themultiplicity  i.e.  (i) Single UAV  and (ii) Multiple UAVs. We found that verylittle has been done to secure the FPV flight mode against path deviation. InGNSS mode  spoofing is the most worrisome attack. The best defense againstspoofing seems to be redundancy  such as adding vision chips to single UAV orusing multiple arranged UAVs. No specific attacks and defenses have been foundin literature for GNSS+ or for UAVs moving in group without a pre-orderedarrangement. These aspects require further investigation.
http://arxiv.org/abs/2102.06573, Bayesian Quadrature on Riemannian Data Manifolds,Riemannian manifolds provide a principled way to model nonlinear geometricstructure inherent in data. A Riemannian metric on said manifolds determinesgeometry-aware shortest paths and provides the means to define statisticalmodels accordingly. However  these operations are typically computationallydemanding. To ease this computational burden  we advocate probabilisticnumerical methods for Riemannian statistics. In particular  we focus onBayesian quadrature (BQ) to numerically compute integrals over normal laws onRiemannian manifolds learned from data. In this task  each function evaluationrelies on the solution of an expensive initial value problem. We show that byleveraging both prior knowledge and an active exploration scheme  BQsignificantly reduces the number of required evaluations and thus outperformsMonte Carlo methods on a wide range of integration problems. As a concreteapplication  we highlight the merits of adopting Riemannian geometry with ourproposed framework on a nonlinear dataset from molecular dynamics.
http://arxiv.org/abs/2102.06575, A Critical Look At The Identifiability of Causal Effects with Deep  Latent Variable Models,Using deep latent variable models in causal inference has attractedconsiderable interest recently  but an essential open question is theiridentifiability. While they have yielded promising results and theory exists onthe identifiability of some simple model formulations  we also know that causaleffects cannot be identified in general with latent variables. We investigatethis gap between theory and empirical results with theoretical considerationsand extensive experiments under multiple synthetic and real-world data sets using the causal effect variational autoencoder (CEVAE) as a case study. WhileCEVAE seems to work reliably under some simple scenarios  it does not identifythe correct causal effect with a misspecified latent variable or a complex datadistribution  as opposed to the original goals of the model. Our results showthat the question of identifiability cannot be disregarded  and we argue thatmore attention should be paid to it in future work.
http://arxiv.org/abs/2102.06578, Robust White Matter Hyperintensity Segmentation on Unseen Domain,Typical machine learning frameworks heavily rely on an underlying assumptionthat training and test data follow the same distribution. In medical imagingwhich increasingly begun acquiring datasets from multiple sites or scanners this identical distribution assumption often fails to hold due to systematicvariability induced by site or scanner dependent factors. Therefore  we cannotsimply expect a model trained on a given dataset to consistently work well  orgeneralize  on a dataset from another distribution. In this work  we addressthis problem  investigating the application of machine learning models tounseen medical imaging data. Specifically  we consider the challenging case ofDomain Generalization (DG) where we train a model without any knowledge aboutthe testing distribution. That is  we train on samples from a set ofdistributions (sources) and test on samples from a new  unseen distribution(target). We focus on the task of white matter hyperintensity (WMH) predictionusing the multi-site WMH Segmentation Challenge dataset and our local in-housedataset. We identify how two mechanically distinct DG approaches  namely domainadversarial learning and mix-up  have theoretical synergy. Then  we showdrastic improvements of WMH prediction on an unseen target domain.
http://arxiv.org/abs/2102.06580, Barriers for recent methods in geodesic optimization,We study a class of optimization problems including matrix scaling  matrixbalancing  multidimensional array scaling  operator scaling  and tensor scalingthat arise frequently in theory and in practice. Some of these problems  suchas matrix and array scaling  are convex in the Euclidean sense  but others suchas operator scaling and tensor scaling are \emph{geodesically convex} on adifferent Riemannian manifold. Trust region methods  which includebox-constrained Newton's method  are known to produce high precision solutionsvery quickly for matrix scaling and matrix balancing (Cohen et. al.  FOCS 2017 Allen-Zhu et. al. FOCS 2017)  and result in polynomial time algorithms for somegeodesically convex problems like operator scaling (Garg et. al. STOC 2018 B\ urgisser et. al. FOCS 2019). One is led to ask whether these guarantees alsohold for multidimensional array scaling and tensor scaling.We show that this is not the case by exhibiting instances with exponential\emph{diameter bound}: we construct polynomial-size instances of 3-dimensionalarray scaling and 3-tensor scaling whose approximate solutions all have doublyexponential condition number. Moreover  we study convex-geometric notions ofcomplexity known as margin and gap  which are used to bound the running timesof all existing optimization algorithms for such problems. We show that marginand gap are exponentially small for several problems including array scaling tensor scaling and polynomial scaling. Our results suggest that it isimpossible to prove polynomial running time bounds for tensor scaling based ondiameter bounds alone. Therefore  our work motivates the search for analoguesof more sophisticated algorithms  such as interior point methods  forgeodesically convex optimization that do not rely on polynomial diameterbounds.
http://arxiv.org/abs/2102.06583, Responsibility and verification: Importance value in temporal logics,We aim at measuring the influence of the nondeterministic choices of a partof a system on its ability to satisfy a specification. For this purpose  weapply the concept of Shapley values to verification as a means to evaluate howimportant a part of a system is. The importance of a component is measured bygiving its control to an adversary  alone or along with other components  andtesting whether the system can still fulfill the specification. We study thisidea in the framework of model-checking with various classical types oflinear-time specification  and propose several ways to transpose it tobranching ones. We also provide tight complexity bounds in almost every case.
http://arxiv.org/abs/2102.06584, Leveraging Artificial Intelligence to Analyze the COVID-19 Distribution  Pattern based on Socio-economic Determinants,The spatialization of socioeconomic data can be used and integrated withother sources of information to reveal valuable insights. Such data can beutilized to infer different variations  such as the dynamics of city dwellersand their spatial and temporal variability. This work focuses on suchapplications to explore the underlying association between socioeconomiccharacteristics of different geographical regions in Dublin  Ireland  and thenumber of confirmed COVID cases in each area. Our aim is to implement a machinelearning approach to identify demographic characteristics and spatial patterns.Spatial analysis was used to describe the pattern of interest in ElectoralDivisions (ED)  which are the legally defined administrative areas in theRepublic of Ireland for which population statistics are published from thecensus data. We used the most informative variables of the census data to modelthe number of infected people in different regions at ED level.
http://arxiv.org/abs/2102.06585, End-to-end Audio-visual Speech Recognition with Conformers,In this work  we present a hybrid CTC/Attention model based on a ResNet-18and Convolution-augmented transformer (Conformer)  that can be trained in anend-to-end manner. In particular  the audio and visual encoders learn toextract features directly from raw pixels and audio waveforms  respectively which are then fed to conformers and then fusion takes place via a Multi-LayerPerceptron (MLP). The model learns to recognise characters using a combinationof CTC and an attention mechanism. We show that end-to-end training  instead ofusing pre-computed visual features which is common in the literature  the useof a conformer  instead of a recurrent network  and the use of atransformer-based language model  significantly improve the performance of ourmodel. We present results on the largest publicly available datasets forsentence-level speech recognition  Lip Reading Sentences 2 (LRS2) and LipReading Sentences 3 (LRS3)  respectively. The results show that our proposedmodels raise the state-of-the-art performance by a large margin in audio-only visual-only  and audio-visual experiments.
http://arxiv.org/abs/2102.06587, Leveraging Artificial Intelligence to Analyze Citizens' Opinions on  Urban Green Space,Continued population growth and urbanization is shifting research to considerthe quality of urban green space over the quantity of these parks  woods  andwetlands. The quality of urban green space has been hitherto measured by expertassessments  including in-situ observations  surveys  and remote sensinganalyses. Location data platforms  such as TripAdvisor  can provide people'sopinion on many destinations and experiences  including UGS. This paperleverages Artificial Intelligence techniques for opinion mining and textclassification using such platform's reviews as a novel approach to urban greenspace quality assessments. Natural Language Processing is used to analyzecontextual information given supervised scores of words by implementingcomputational analysis. Such an application can support local authorities andstakeholders in their understanding of and justification for future investmentsin urban green space.
http://arxiv.org/abs/2102.06588, Numerical investigation of Mach number consistent Roe solvers for the  Euler equations of gas dynamics,While traditional approaches to prevent the carbuncle phenomenon in gasdynamics simulations increase the viscosity on entropy and shear waves nearshocks  it was quite recently suggested to instead decrease the viscosity onthe acoustic waves for low Mach numbers. The goal is to achieve what  in thispaper  we call Mach number consistency: for all waves  the numerical viscositydecreases with the same order of the Mach number when the Mach number tends tozero. We take the simple approach that was used for the proof of concepttogether with the simple model for the increased numerical viscosity on linearwaves and investigate the possibilities of combining both in an adaptive mannerwhile locally maintaining Mach number consistency.
http://arxiv.org/abs/2102.06589, Qualifying Software Engineers Undergraduates in DevOps -- Challenges of  Introducing Technical and Non-technical Concepts in a Project-oriented Course,The constant changes in the software industry  practices  and methodologiesimpose challenges to teaching and learning current software engineeringconcepts and skills. DevOps is particularly challenging because it coverstechnical concepts  such as pipeline automation  and non-technical ones  suchas team roles and project management. The present study investigates a coursesetup to introduce these concepts to software engineering undergraduates. Wedesigned the course by employing coding to associate DevOps concepts to Agile Lean  and Open source practices and tools. We present the main aspects of thisproject-oriented DevOps course  with 240 students enrolled in it since itsfirst offering in 2016. We conducted an empirical study  with both aquantitative and qualitative analysis  to evaluate this project-oriented coursesetup. We collected the data from the projects repository and studentsperceptions from a questionnaire. We mined 148 repositories (corresponding to72 projects) and obtained 86 valid responses to the questionnaire. We alsomapped the concepts which are more challenging to students learn fromexperience. The results evidence that first-hand experience facilitates thecomprehension of DevOps concepts and enriches classes discussions. We present aset of lessons learned  which may help professors better design and conductproject-oriented courses to cover DevOps concepts.
http://arxiv.org/abs/2102.06590, What helped  and what did not? An Evaluation of the Strategies to  Improve Continuous Integration,Continuous integration (CI) is a widely used practice in modern softwareengineering. Unfortunately  it is also an expensive practice - Google andMozilla estimate their CI systems in millions of dollars. There are a number oftechniques and tools designed to or having the potential to save the cost of CIor expand its benefit - reducing time to feedback. However  their benefits insome dimensions may also result in drawbacks in others. They may also bebeneficial in other scenarios where they are not designed to help. In thispaper  we perform the first exhaustive comparison of techniques to improve CI evaluating 14 variants of 10 techniques using selection and prioritizationstrategies on build and test granularity. We evaluate their strengths andweaknesses with 10 different cost and time-tofeedback saving metrics on 100real-world projects. We analyze the results of all techniques to understand thedesign decisions that helped different dimensions of benefit. We alsosynthesized those results to lay out a series of recommendations for thedevelopment of future research techniques to advance this area.
http://arxiv.org/abs/2102.06591, Online voluntary mentoring: Optimising the assignment of students and  mentors,After the closure of the schools in Hungary from March 2020 due to thepandemic  many students were left at home with no or not enough parental helpfor studying  and in the meantime some people had more free time andwillingness to help others in need during the lockdown. In this paper wedescribe the optimisation aspects of a joint NGO project for allocatingvoluntary mentors to students using a web-based coordination mechanism. Thegoal of the project has been to form optimal pairs and study groups by takinginto the preferences and the constraints of the participants. In this paper wepresent the optimisation concept  and the integer programming techniques usedfor solving the allocation problems. Furthermore  we conducted computationsimulations on real and generated data for evaluate the performance of thisdynamic matching scheme under different parameter settings.
http://arxiv.org/abs/2102.06593, Proof complexity of positive branching programs,We investigate the proof complexity of systems based on positive branchingprograms  i.e. non-deterministic branching programs (NBPs) where  for any0-transition between two nodes  there is also a 1-transition. Positive NBPscompute monotone Boolean functions  just like negation-free circuits orformulas  but constitute a positive version of (non-uniform) NL  rather than Por NC1  respectively.The proof complexity of NBPs was investigated in previous work by Buss  Dasand Knop  using extension variables to represent the dag-structure  over alanguage of (non-deterministic) decision trees  yielding the system eLNDT. Oursystem eLNDT+ is obtained by restricting their systems to a positive syntax similarly to how the 'monotone sequent calculus' MLK is obtained from the usualsequent calculus LK by restricting to negation-free formulas.Our main result is that eLNDT+ polynomially simulates eLNDT over positivesequents. Our proof method is inspired by a similar result for MLK by Atserias Galesi and Pudl\'ak  that was recently improved to a bona fide polynomialsimulation via works of Je\v{r}\'abek and Buss  Kabanets  Kolokolova andKouck\'y. Along the way we formalise several properties of counting functionswithin eLNDT+ by polynomial-size proofs and  as a case study  give explicitpolynomial-size poofs of the propositional pigeonhole principle.
http://arxiv.org/abs/2102.06599, A model for traffic incident prediction using emergency braking data,This article presents a model for traffic incident prediction. Specifically we address the fundamental problem of data scarcity in road traffic accidentprediction by training our model on emergency braking events instead ofaccidents. Based on relevant risk factors for traffic accidents andcorresponding data categories  we evaluate different options for preprocessingsparse data and different Machine Learning models. Furthermore  we present aprototype implementing a traffic incident prediction model for Germany based onemergency braking data from Mercedes-Benz vehicles as well as weather  trafficand road data  respectively. After model evaluation and optimisation  we foundthat a Random Forest model trained on artificially balanced (under-sampled)data provided the highest classification accuracy of 85% on the originalimbalanced data. Finally  we present our conclusions and discuss further work;from gathering more data over a longer period of time to build strongerclassification systems  to addition of internal factors such as the driver'svisual and cognitive attention.
http://arxiv.org/abs/2102.06601, Adversarial Branch Architecture Search for Unsupervised Domain  Adaptation,Unsupervised Domain Adaptation (UDA) is a key field in visual recognition  asit enables robust performances across different visual domains. In the deeplearning era  the performance of UDA methods has been driven by better lossesand by improved network architectures  specifically the addition of auxiliarydomain-alignment branches to pre-trained backbones. However  all the neuralarchitectures proposed so far are hand-crafted  which might hinder furtherprogress.The current copious offspring of Neural Architecture Search (NAS) onlyalleviates hand-crafting so far  as it requires labels for model selection which are not available in UDA  and is usually applied to the wholearchitecture  while using pre-trained models is a strict requirement for highperformance. No prior work has addressed these aspects in the context of NASfor UDA.Here we propose an Adversarial Branch Architecture Search (ABAS) for UDA  tolearn the auxiliary branch network from data without handcrafting. Our maincontribution include i. a novel data-driven ensemble approach for modelselection  to circumvent the lack of target labels  and ii. a pipeline toautomatically search for the best performing auxiliary branch.To the best of our knowledge  ABAS is the first NAS method for UDA to complywith a pre-trained backbone  a strict requirement for high performance. ABASoutputs both the optimal auxiliary branch and its trained parameters. Whenapplied to two modern UDA techniques  DANN and ALDA  it improves performance onthree standard CV datasets (Office31  Office-Home and PACS). In all cases  ABASrobustly finds the branch architectures which yield best performances. Codewill be released.
http://arxiv.org/abs/2102.06602, Low precision logarithmic number systems: Beyond base-2,Logarithmic number systems (LNS) are used to represent real numbers in manyapplications using a constant base raised to a fixed-point exponent making itsdistribution exponential. This greatly simplifies hardware multiply  divide andsquare root. LNS with base-2 is most common  but in this paper we show that forlow-precision LNS the choice of base has a significant impact.We make four main contributions. First  LNS is not closed under addition andsubtraction  so the result is approximate. We show that choosing a suitablebase can manipulate the distribution to reduce the average error. Second  weshow that low-precision LNS addition and subtraction can be implementedefficiently in logic rather than commonly used ROM lookup tables  thecomplexity of which can be reduced by an appropriate choice of base. A similareffect is shown where the result of arithmetic has greater precision than theinput. Third  where input data from external sources is not expected to be inLNS  we can reduce the conversion error by selecting a LNS base to match theexpected distribution of the input. Thus  there is no one base which gives theglobal optimum  and base selection is a trade-off between different factors.Fourth  we show that circuits realized in LNS require lower area and powerconsumption for short word lengths.
http://arxiv.org/abs/2102.06603, DeepGLEAM: an hybrid mechanistic and deep learning model for COVID-19  forecasting,We introduce DeepGLEAM  a hybrid model for COVID-19 forecasting. DeepGLEAMcombines a mechanistic stochastic simulation model GLEAM with deep learning. Ituses deep learning to learn the correction terms from GLEAM  which leads toimproved performance. We further integrate various uncertainty quantificationmethods to generate confidence intervals. We demonstrate DeepGLEAM onreal-world COVID-19 mortality forecasting tasks.
