link,title,description
http://arxiv.org/abs/2102.06485, Leveraging Reinforcement Learning for evaluating Robustness of KNN  Search Algorithms,The problem of finding K-nearest neighbors in the given dataset for a givenquery point has been worked upon since several years. In very high dimensionalspaces the K-nearest neighbor search (KNNS) suffers in terms of complexity incomputation of high dimensional distances. With the issue of curse ofdimensionality  it gets quite tedious to reliably bank on the results ofvariety approximate nearest neighbor search approaches. In this paper  wesurvey some novel K-Nearest Neighbor Search approaches that tackles the problemof Search from the perspectives of computations  the accuracy of approximatedresults and leveraging parallelism to speed-up computations. We attempt toderive a relationship between the true positive and false points for a givenKNNS approach. Finally  in order to evaluate the robustness of a KNNS approachagainst adversarial points  we propose a generic Reinforcement Learning basedframework for the same.
http://arxiv.org/abs/2102.06486, Mutually exciting point process graphs for modelling dynamic networks,A new class of models for dynamic networks is proposed  called mutuallyexciting point process graphs (MEG)  motivated by a practical application incomputer network security. MEG is a scalable network-wide statistical model forpoint processes with dyadic marks  which can be used for anomaly detection whenassessing the significance of previously unobserved connections. The modelcombines mutually exciting point processes to estimate dependencies betweenevents and latent space models to infer relationships between the nodes. Theintensity functions for each network edge are parameterised exclusively bynode-specific parameters  which allows information to be shared across thenetwork. Fast inferential procedures using modern gradient ascent algorithmsare exploited. The model is tested on simulated graphs and real world computernetwork datasets  demonstrating excellent performance.
http://arxiv.org/abs/2102.06489, A Tale of Two Countries: A Longitudinal Cross-Country Study of Mobile  Users' Reactions to the COVID-19 Pandemic Through the Lens of App Popularity,The ongoing COVID-19 pandemic has profoundly impacted people's life aroundthe world  including how they interact with mobile technologies. In this paper we seek to develop an understanding of how the dynamic trajectory of a pandemicshapes mobile phone users' experiences. Through the lens of app popularity  weapproach this goal from a cross-country perspective. We compile a datasetconsisting of six-month daily snapshots of the most popular apps in the iOS AppStore in China and the US  where the pandemic has exhibited distincttrajectories. Using this longitudinal dataset  our analysis provides detailedpatterns of app ranking during the pandemic at both category and individual applevels. We reveal that app categories' rankings are correlated with thepandemic  contingent upon country-specific development trajectories. Our workoffers rich insights into how the COVID-19  a typical global public healthcrisis  has influence people's day-to-day interaction with the Internet andmobile technologies.
http://arxiv.org/abs/2102.06491, Improving Object Detection in Art Images Using Only Style Transfer,Despite recent advances in object detection using deep learning neuralnetworks  these neural networks still struggle to identify objects in artimages such as paintings and drawings. This challenge is known as the crossdepiction problem and it stems in part from the tendency of neural networks toprioritize identification of an object's texture over its shape. In this paperwe propose and evaluate a process for training neural networks to localizeobjects - specifically people - in art images. We generate a large dataset fortraining and validation by modifying the images in the COCO dataset using AdaInstyle transfer. This dataset is used to fine-tune a Faster R-CNN objectdetection network  which is then tested on the existing People-Art testingdataset. The result is a significant improvement on the state of the art and anew way forward for creating datasets to train neural networks to process artimages.
http://arxiv.org/abs/2102.06492, Algebraic cocompleteness and finitary functors,A number of categories is presented that are algebraically complete andcocomplete  i.e.  every endofunctor has an initial algebra and a terminalcoalgebra. For all finitary (and  more generally  all precontinuous) setfunctors the initial algebra and terminal coalgebra are proved to carry acanonical partial order with the same ideal CPO-completion. And they also bothcarry a canonical ultrametric with the same Cauchy completion.
http://arxiv.org/abs/2102.06495, CrossStack: A 3-D Reconfigurable RRAM Crossbar Inference Engine,Deep neural network inference accelerators are rapidly growing in importanceas we turn to massively parallelized processing beyond GPUs and ASICs. Thedominant operation in feedforward inference is the multiply-and-accumlateprocess  where each column in a crossbar generates the current response of asingle neuron. As a result  memristor crossbar arrays parallelize inference andimage processing tasks very efficiently. In this brief  we present a 3-D activememristor crossbar array `CrossStack'  which adopts stacked pairs ofAl/TiO2/TiO2-x/Al devices with common middle electrodes. By designingCMOS-memristor hybrid cells used in the layout of the array  CrossStack canoperate in one of two user-configurable modes as a reconfigurable inferenceengine: 1) expansion mode and 2) deep-net mode. In expansion mode  theresolution of the network is doubled by increasing the number of inputs for agiven chip area  reducing IR drop by 22%. In deep-net mode  inference speedper-10-bit convolution is improved by 29\% by simultaneously using oneTiO2/TiO2-x layer for read processes  and the other for write processes. Weexperimentally verify both modes on our  10 imes10 imes2  array.
http://arxiv.org/abs/2102.06496, Lazy Hermite Reduction and Creative Telescoping for Algebraic Functions,We present criteria on the existence of telescopers for trivariate rationalfunctions in four mixed cases  in which discrete and continuous variablesappear simultaneously. We reduce the existence problem in the trivariate caseto the exactness testing problem  the separation problem and the existenceproblem in the bivariate case. The existence criteria we present help usdetermine the termination of Zeilberger's algorithm for the input functionsstudied in this paper.
http://arxiv.org/abs/2102.06500, Jacobian Determinant of Normalizing Flows,Normalizing flows learn a diffeomorphic mapping between the target and basedistribution  while the Jacobian determinant of that mapping forms anotherreal-valued function. In this paper  we show that the Jacobian determinantmapping is unique for the given distributions  hence the likelihood objectiveof flows has a unique global optimum. In particular  the likelihood for a classof flows is explicitly expressed by the eigenvalues of the auto-correlationmatrix of individual data point  and independent of the parameterization ofneural network  which provides a theoretical optimal value of likelihoodobjective and relates to probabilistic PCA. Additionally  Jacobian determinantis a measure of local volume change and is maximized when MLE is used foroptimization. To stabilize normalizing flows training  it is required tomaintain a balance between the expansiveness and contraction of volume  meaningLipschitz constraint on the diffeomorphic mapping and its inverse. With thesetheoretical results  several principles of designing normalizing flow wereproposed. And numerical experiments on highdimensional datasets (such asCelebA-HQ 1024x1024) were conducted to show the improved stability of training.
http://arxiv.org/abs/2102.06501, Two Training Strategies for Improving Relation Extraction over Universal  Graph,This paper explores how the Distantly Supervised Relation Extraction (DS-RE)can benefit from the use of a Universal Graph (UG)  the combination of aKnowledge Graph (KG) and a large-scale text collection. A straightforwardextension of a current state-of-the-art neural model for DS-RE with a UG maylead to degradation in performance. We first report that this degradation isassociated with the difficulty in learning a UG and then propose two trainingstrategies: (1) Path Type Adaptive Pretraining  which sequentially trains themodel with different types of UG paths so as to prevent the reliance on asingle type of UG path; and (2) Complexity Ranking Guided Attention mechanism which restricts the attention span according to the complexity of a UG path soas to force the model to extract features not only from simple UG paths butalso from complex ones. Experimental results on both biomedical and NYT10datasets prove the robustness of our methods and achieve a new state-of-the-artresult on the NYT10 dataset. The code and datasets used in this paper areavailable at https://github.com/baodaiqin/UGDSRE.
http://arxiv.org/abs/2102.06502, Computing Betweenness Centrality in Link Streams,Betweeness centrality is one of the most important concepts in graphanalysis. It was recently extended to link streams  a graph generalizationwhere links arrive over time. However  its computation raises non-trivialissues  due in particular to the fact that time is considered as continuous. Weprovide here the first algorithms to compute this generalized betweennesscentrality  as well as several companion algorithms that have their owninterest. They work in polynomial time and space  we illustrate them on typicalexamples  and we provide an implementation.
http://arxiv.org/abs/2102.06503, A Little Pretraining Goes a Long Way: A Case Study on Dependency Parsing  Task for Low-resource Morphologically Rich Languages,Neural dependency parsing has achieved remarkable performance for manydomains and languages. The bottleneck of massive labeled data limits theeffectiveness of these approaches for low resource languages. In this work  wefocus on dependency parsing for morphological rich languages (MRLs) in alow-resource setting. Although morphological information is essential for thedependency parsing task  the morphological disambiguation and lack of powerfulanalyzers pose challenges to get this information for MRLs. To address thesechallenges  we propose simple auxiliary tasks for pretraining. We performexperiments on 10 MRLs in low-resource settings to measure the efficacy of ourproposed pretraining method and observe an average absolute gain of 2 points(UAS) and 3.6 points (LAS). Code and data available at:https://github.com/jivnesh/LCM
http://arxiv.org/abs/2102.06504, From System Level Synthesis to Robust Closed-loop Data-enabled  Predictive Control,The Willem's fundamental lemma and the system level synthesis characterizetrajectories generated by a linear system. While the former method is valid fordeterministic LTI systems  the latter one is further effective for stochasticlinear time varying systems. In this paper  these two methods offers equivalentcharacterization of stochastic LTI systems. Inspired by this observation  arobust closed-loop data-enabled predictive control scheme is proposed forstochastic LTI systems. A causal feedback structure is further derived  leadingto an computational cost similar to standard robust MPC with full statemeasurements.
http://arxiv.org/abs/2102.06505, Exploiting Spline Models for the Training of Fully Connected Layers in  Neural Network,The fully connected (FC) layer  one of the most fundamental modules inartificial neural networks (ANN)  is often considered difficult and inefficientto train due to issues including the risk of overfitting caused by its largeamount of parameters. Based on previous work studying ANN from linear splineperspectives  we propose a spline-based approach that eases the difficulty oftraining FC layers. Given some dataset  we first obtain a continuous piece-wiselinear (CPWL) fit through spline methods such as multivariate adaptiveregression spline (MARS). Next  we construct an ANN model from the linearspline model and continue to train the ANN model on the dataset using gradientdescent optimization algorithms. Our experimental results and theoreticalanalysis show that our approach reduces the computational cost  accelerates theconvergence of FC layers  and significantly increases the interpretability ofthe resulting model (FC layers) compared with standard ANN training with randomparameter initialization followed by gradient descent optimizations.
http://arxiv.org/abs/2102.06507, Online Graph Dictionary Learning,Dictionary learning is a key tool for representation learning  that explainsthe data as linear combination of few basic elements. Yet  this analysis is notamenable in the context of graph learning  as graphs usually belong todifferent metric spaces. We fill this gap by proposing a new online GraphDictionary Learning approach  which uses the Gromov Wasserstein divergence forthe data fitting term. In our work  graphs are encoded through their nodes'pairwise relations and modeled as convex combination of graph atoms  i.e.dictionary elements  estimated thanks to an online stochastic algorithm  whichoperates on a dataset of unregistered graphs with potentially different numberof nodes. Our approach naturally extends to labeled graphs  and is completed bya novel upper bound that can be used as a fast approximation of GromovWasserstein in the embedding space. We provide numerical evidences showing theinterest of our approach for unsupervised embedding of graph datasets and foronline graph subspace estimation and tracking.
http://arxiv.org/abs/2102.06509, Updatable Materialization of Approximate Constraints,Modern big data applications integrate data from various sources. As aresult  these datasets may not satisfy perfect constraints  leading to sparseschema information and non-optimal query performance. The existing approach ofPatchIndexes enable the definition of approximate constraints and improve queryperformance by exploiting the materialized constraint information. As realworld data warehouse workloads are often not limited to read-only queries  weenhance the PatchIndex structure towards an update-conscious design in thispaper. Therefore  we present a sharded bitmap as the underlying data structurewhich offers efficient update operations  and describe approaches to maintainapproximate constraints under updates  avoiding index recomputations and fulltable scans. In our evaluation  we prove that PatchIndexes significantly impactquery performance while achieving lightweight update support.
http://arxiv.org/abs/2102.06511, Continuous Learning in Neural Machine Translation using Bilingual  Dictionaries,While recent advances in deep learning led to significant improvements inmachine translation  neural machine translation is often still not able tocontinuously adapt to the environment. For humans  as well as for machinetranslation  bilingual dictionaries are a promising knowledge source tocontinuously integrate new knowledge. However  their exploitation poses severalchallenges: The system needs to be able to perform one-shot learning as well asmodel the morphology of source and target language.In this work  we proposed an evaluation framework to assess the ability ofneural machine translation to continuously learn new phrases. We integrateone-shot learning methods for neural machine translation with different wordrepresentations and show that it is important to address both in order tosuccessfully make use of bilingual dictionaries. By addressing both challengeswe are able to improve the ability to translate new  rare words and phrasesfrom 30% to up to 70%. The correct lemma is even generated by more than 90%.
http://arxiv.org/abs/2102.06513, How Far Should We Look Back to Achieve Effective Real-Time Time-Series  Anomaly Detection?,Anomaly detection is the process of identifying unexpected events orab-normalities in data  and it has been applied in many different areas such assystem monitoring  fraud detection  healthcare  intrusion detection  etc.Providing real-time  lightweight  and proactive anomaly detection for timeseries with neither human intervention nor domain knowledge could be highlyvaluable since it reduces human effort and enables appropriate countermeasuresto be undertaken before a disastrous event occurs. To our knowledge  RePAD(Real-time Proactive Anomaly Detection algorithm) is a generic approach withall above-mentioned features. To achieve real-time and lightweight detection RePAD utilizes Long Short-Term Memory (LSTM) to detect whether or not eachupcoming data point is anomalous based on short-term historical data points.However  it is unclear that how different amounts of historical data pointsaffect the performance of RePAD. Therefore  in this paper  we investigate theimpact of different amounts of historical data on RePAD by introducing a set ofperformance metrics that cover novel detection accuracy measures  timeefficiency  readiness  and resource consumption  etc. Empirical experimentsbased on real-world time series datasets are conducted to evaluate RePAD indifferent scenarios  and the experimental results are presented and discussed.
http://arxiv.org/abs/2102.06514, Querying collections of tree-structured records in the presence of  within-record referential constraints,In this paper  we consider a tree-structured data model used in manycommercial databases like Dremel  F1  JSON. We define identity and referentialconstraints within each tree-structured record. The query language is a variantof SQL and flattening is used as an evaluation mechanism. We investigatequerying in the presence of these constraints  and point out the challengesthat arise from taking them into account during query evaluation.
http://arxiv.org/abs/2102.06515, Analysis of Interpolation based Image In-painting Approaches,Interpolation and internal painting are one of the basic approaches in imageinternal painting  which is used to eliminate undesirable parts that occur indigital images or to enhance faulty parts. This study was designed to comparethe interpolation algorithms used in image in-painting in the literature.Errors and noise generated on the colour and grayscale formats of some of thecommonly used standard images in the literature were corrected by using Cubic Kriging  Radial based function and High dimensional model representationapproaches and the results were compared using standard image comparisoncriteria  namely  PSNR (peak signal-to-noise ratio)  SSIM (StructuralSIMilarity)  Mean Square Error (MSE). According to the results obtained fromthe study  the absolute superiority of the methods against each other was notobserved. However  Kriging and RBF interpolation give better results both fornumerical data and visual evaluation for image in-painting problems with largearea losses.
http://arxiv.org/abs/2102.06516, Work-Optimal Parallel Minimum Cuts for Non-Sparse Graphs,We present the first work-optimal polylogarithmic-depth parallel algorithmfor the minimum cut problem on non-sparse graphs. For  m\geq n^{1+\epsilon} for any constant  \epsilon>0   our algorithm requires  O(m \log n)  work and O(\log^3 n)  depth and succeeds with high probability. Its work matches thebest  O(m \log n)  runtime for sequential algorithms [MN STOC 2020  GMW SOSA2021]. This improves the previous best work by Geissmann and Gianinazzi [SPAA2018] by  O(\log^3 n)  factor  while matching the depth of their algorithm. Todo this  we design a work-efficient approximation algorithm and parallelize therecent sequential algorithms [MN STOC 2020; GMW SOSA 2021] that exploit aconnection between 2-respecting minimum cuts and 2-dimensional orthogonal rangesearching.
http://arxiv.org/abs/2102.06518, User manual for bch  a program for the fast computation of the  Baker-Campbell-Hausdorff and similar series,This manual describes bch  an efficient program written in the C programminglanguage for the fast computation of the Baker-Campbell-Hausdorff (BCH) andsimilar Lie series. The Lie series can be represented in the Lyndon basis  inthe classical Hall basis  or in the right-normed basis of E.S. Chibrikov. Inthe Lyndon basis  which proves to be particularly efficient for this purpose the computation of 111013 coefficients for the BCH series up to terms of degree20 takes less than half a second on an ordinary personal computer and requiresnegligible 11MB of memory. Up to terms of degree 30  which is the maximumdegree the program can handle  the computation of 74248451 coefficients takes55 hours but still requires only a modest 5.5GB of memory.
http://arxiv.org/abs/2102.06520, Estimation and Applications of Quantiles in Deep Binary Classification,Quantile regression  based on check loss  is a widely used inferentialparadigm in Econometrics and Statistics. The conditional quantiles provide arobust alternative to classical conditional means  and also allow uncertaintyquantification of the predictions  while making very few distributionalassumptions. We consider the analogue of check loss in the binaryclassification setting. We assume that the conditional quantiles are smoothfunctions that can be learnt by Deep Neural Networks (DNNs). Subsequently  wecompute the Lipschitz constant of the proposed loss  and also show that itscurvature is bounded  under some regularity conditions. Consequently  recentresults on the error rates and DNN architecture complexity become directlyapplicable.We quantify the uncertainty of the class probabilities in terms of predictionintervals  and develop individualized confidence scores that can be used todecide whether a prediction is reliable or not at scoring time. By aggregatingthe confidence scores at the dataset level  we provide two additional metrics model confidence  and retention rate  to complement the widely used classifiersummaries. We also the robustness of the proposed non-parametric binaryquantile classification framework are also studied  and we demonstrate how toobtain several univariate summary statistics of the conditional distributions in particular conditional means  using smoothed conditional quantiles  allowingthe use of explanation techniques like Shapley to explain the mean predictions.Finally  we demonstrate an efficient training regime for this loss based onStochastic Gradient Descent with Lipschitz Adaptive Learning Rates (LALR).
http://arxiv.org/abs/2102.06521, Improving Zero-shot Neural Machine Translation on Language-specific  Encoders-Decoders,Recently  universal neural machine translation (NMT) with sharedencoder-decoder gained good performance on zero-shot translation. Unlikeuniversal NMT  jointly trained language-specific encoders-decoders aim toachieve universal representation across non-shared modules  each of which isfor a language or language family. The non-shared architecture has theadvantage of mitigating internal language competition  especially when theshared vocabulary and model parameters are restricted in their size. However the performance of using multiple encoders and decoders on zero-shottranslation still lags behind universal NMT. In this work  we study zero-shottranslation using language-specific encoders-decoders. We propose to generalizethe non-shared architecture and universal NMT by differentiating theTransformer layers between language-specific and interlingua. By selectivelysharing parameters and applying cross-attentions  we explore maximizing therepresentation universality and realizing the best alignment oflanguage-agnostic information. We also introduce a denoising auto-encoding(DAE) objective to jointly train the model with the translation task in amulti-task manner. Experiments on two public multilingual parallel datasetsshow that our proposed model achieves a competitive or better results thanuniversal NMT and strong pivot baseline. Moreover  we experiment incrementallyadding new language to the trained model by only updating the new modelparameters. With this little effort  the zero-shot translation between thisnewly added language and existing languages achieves a comparable result withthe model trained jointly from scratch on all languages.
http://arxiv.org/abs/2102.06522, Fuzzing Symbolic Expressions,Recent years have witnessed a wide array of results in software testing exploring different approaches and methodologies ranging from fuzzers tosymbolic engines  with a full spectrum of instances in between such as concolicexecution and hybrid fuzzing. A key ingredient of many of these tools isSatisfiability Modulo Theories (SMT) solvers  which are used to reason oversymbolic expressions collected during the analysis. In this paper  weinvestigate whether techniques borrowed from the fuzzing domain can be appliedto check whether symbolic formulas are satisfiable in the context of concolicand hybrid fuzzing engines  providing a viable alternative to classic SMTsolving techniques. We devise a new approximate solver  FUZZY-SAT  and showthat it is both competitive with and complementary to state-of-the-art solverssuch as Z3 with respect to handling queries generated by hybrid fuzzers.
