link,title,description
http://arxiv.org/abs/2102.06352, Multiplex Bipartite Network Embedding using Dual Hypergraph  Convolutional Networks,A bipartite network is a graph structure where nodes are from two distinctdomains and only inter-domain interactions exist as edges. A large number ofnetwork embedding methods exist to learn vectorial node representations fromgeneral graphs with both homogeneous and heterogeneous node and edge types including some that can specifically model the distinct properties of bipartitenetworks. However  these methods are inadequate to model multiplex bipartitenetworks (e.g.  in e-commerce)  that have multiple types of interactions (e.g. click  inquiry  and buy) and node attributes. Most real-world multiplexbipartite networks are also sparse and have imbalanced node distributions thatare challenging to model. In this paper  we develop an unsupervised DualHyperGraph Convolutional Network (DualHGCN) model that scalably transforms themultiplex bipartite network into two sets of homogeneous hypergraphs and usesspectral hypergraph convolutional operators  along with intra- andinter-message passing strategies to promote information exchange within andacross domains  to learn effective node embedding. We benchmark DualHGCN usingfour real-world datasets on link prediction and node classification tasks. Ourextensive experiments demonstrate that DualHGCN significantly outperformsstate-of-the-art methods  and is robust to varying sparsity levels andimbalanced node distributions.
http://arxiv.org/abs/2102.06355, Speculating Ineffective UI Exploration via Trace Analysis,With the prosperity of mobile apps  quality assurance of mobile apps becomescrucially important. Automated mobile User Interface (UI) testing had arisen asa key technique for app quality assurance. However  despite years of efforts existing mobile UI testing techniques still cannot achieve high code coverage especially for industrial-quality apps. To substantially improve the efficacyof mobile UI testing  we investigate state-of-the-art techniques and find afundamental limitation--each testing technique attempts to apply one predefinedstrategy to explore the UI space of all mobile apps. However  we observe thatdifferent UI design characteristics require customized UI explorationstrategies in practice. With this finding in mind  in this paper  we propose anew direction for mobile UI testing--automatic customization of UI explorationstrategies for each app under test. As a first step in this direction  wetarget ineffective exploration behavior  which refers to cases where UI testingtools fail to make progress effectively. We present Vet as a general frameworkfor applying the idea of trace analysis on UI testing history to identifyineffective exploration behavior for a given UI testing tool on a given app.Vet embraces specialized algorithms for speculating subsequences in the tracethat manifest ineffective exploration behavior of UI space exploration. Vetthen enables enhancing the testing tool by guiding the exploration to avoidineffective exploration. We evaluate Vet by applying it to threestate-of-the-art Android UI testing tools. Vet locates ineffective explorationbehaviors that reveal various tool-app applicability issues hindering testingefficacy. Vet automatically fixes the applicability issues and achieves up to46.8% code coverage relative improvements on 11 of 15 industrial-quality appsunder evaluation.
http://arxiv.org/abs/2102.06356, Neural Inverse Text Normalization,While there have been several contributions exploring state of the arttechniques for text normalization  the problem of inverse text normalization(ITN) remains relatively unexplored. The best known approaches leverage finitestate transducer (FST) based models which rely on manually curated rules andare hence not scalable. We propose an efficient and robust neural solution forITN leveraging transformer based seq2seq models and FST-based textnormalization techniques for data preparation. We show that this can be easilyextended to other languages without the need for a linguistic expert tomanually curate them. We then present a hybrid framework for integrating NeuralITN with an FST to overcome common recoverable errors in productionenvironments. Our empirical evaluations show that the proposed solutionminimizes incorrect perturbations (insertions  deletions and substitutions) toASR output and maintains high quality even on out of domain data. A transformerbased model infused with pretraining consistently achieves a lower WER acrossseveral datasets and is able to outperform baselines on English  Spanish German and Italian datasets.
http://arxiv.org/abs/2102.06357, Uncertainty-of-Information Scheduling: A Restless Multi-armed Bandit  Framework,This paper proposes using the uncertainty of information (UoI)  measured byShannon's entropy  as a metric for information freshness. We consider a systemin which a central monitor observes multiple binary Markov processes through acommunication channel. The UoI of a Markov process corresponds to the monitor'suncertainty about its state. At each time step  only one Markov process can beselected to update its state to the monitor; hence there is a tradeoff amongthe UoIs of the processes that depend on the scheduling policy used to selectthe process to be updated. The age of information (AoI) of a processcorresponds to the time since its last update. In general  the associated UoIcan be a non-increasing function  or even an oscillating function  of its AoI making the scheduling problem particularly challenging. This paper investigatesscheduling policies that aim to minimize the average sum-UoI of the processesover the infinite time horizon. We formulate the problem as a restlessmulti-armed bandit (RMAB) problem  and develop a Whittle index policy that isnear-optimal for the RMAB after proving its indexability. We further provide aniterative algorithm to compute the Whittle index for the practical deploymentof the policy. Although this paper focuses on UoI scheduling  our results applyto a general class of RMABs for which the UoI scheduling problem is a specialcase. Specifically  this paper's Whittle index policy is valid for any RMAB inwhich the bandits are binary Markov processes and the penalty is a concavefunction of the belief state of the Markov process. Numerical resultsdemonstrate the excellent performance of the Whittle index policy for thisclass of RMABs.
http://arxiv.org/abs/2102.06358, The Symmetry between Bandits and Knapsacks: A Primal-Dual LP-based  Approach,In this paper  we study the bandits with knapsacks (BwK) problem and developa primal-dual based algorithm that achieves a problem-dependent logarithmicregret bound. The BwK problem extends the multi-arm bandit (MAB) problem tomodel the resource consumption associated with playing each arm  and theexisting BwK literature has been mainly focused on deriving asymptoticallyoptimal distribution-free regret bounds. We first study the primal and duallinear programs underlying the BwK problem. From this primal-dual perspective we discover symmetry between arms and knapsacks  and then propose a new notionof sub-optimality measure for the BwK problem. The sub-optimality measurehighlights the important role of knapsacks in determining algorithm regret andinspires the design of our two-phase algorithm. In the first phase  thealgorithm identifies the optimal arms and the binding knapsacks  and in thesecond phase  it exhausts the binding knapsacks via playing the optimal armsthrough an adaptive procedure. Our regret upper bound involves the proposedsub-optimality measure and it has a logarithmic dependence on length of horizon T  and a polynomial dependence on  m  (the numbers of arms) and  d  (thenumber of knapsacks). To the best of our knowledge  this is the firstproblem-dependent logarithmic regret bound for solving the general BwK problem.
http://arxiv.org/abs/2102.06360, Multi-source Pseudo-label Learning of Semantic Segmentation for the  Scene Recognition of Agricultural Mobile Robots,This paper describes a novel method of training a semantic segmentation modelfor environment recognition of agricultural mobile robots by unsuperviseddomain adaptation exploiting publicly available datasets of outdoor scenes thatare different from our target environments i.e.  greenhouses. In conventionalsemantic segmentation methods  the labels are given by manual annotation  whichis a tedious and time-consuming task. A method to work around the necessity ofthe manual annotation is unsupervised domain adaptation (UDA) that transferknowledge from labeled source datasets to unlabeled target datasets. Most ofthe UDA methods of semantic segmentation are validated by tasks of adaptationfrom non-photorealistic synthetic images of urban scenes to real ones. However the effectiveness of the methods is not well studied in the case of adaptationto other types of environments  such as greenhouses. In addition  it is notalways possible to prepare appropriate source datasets for such environments.In this paper  we adopt an existing training method of UDA to a task oftraining a model for greenhouse images. We propose to use multiple publiclyavailable datasets of outdoor images as source datasets  and also propose asimple yet effective method of generating pseudo-labels by transferringknowledge from the source datasets that have different appearance and a labelset from the target datasets. We demonstrate in experiments that by combiningour proposed method of pseudo-label generation with the existing trainingmethod  the performance was improved by up to 14.3% of mIoU compared to thebest score of the single-source training.
http://arxiv.org/abs/2102.06361, The Distributed Discrete Gaussian Mechanism for Federated Learning with  Secure Aggregation,We consider training models on private data that is distributed across userdevices. To ensure privacy  we add on-device noise and use secure aggregationso that only the noisy sum is revealed to the server. We present acomprehensive end-to-end system  which appropriately discretizes the data andadds discrete Gaussian noise before performing secure aggregation. We provide anovel privacy analysis for sums of discrete Gaussians. We also analyze theeffect of rounding the input data and the modular summation arithmetic. Ourtheoretical guarantees highlight the complex tension between communication privacy  and accuracy. Our extensive experimental results demonstrate that oursolution is essentially able to achieve a comparable accuracy to centraldifferential privacy with 16 bits of precision per value.
http://arxiv.org/abs/2102.06362, The Software Heritage Filesystem (SwhFS): Integrating Source Code  Archival with Development,We introduce the Software Heritage filesystem (SwhFS)  a user-spacefilesystem that integrates large-scale open source software archival withdevelopment workflows. SwhFS provides a POSIX filesystem view of SoftwareHeritage  the largest public archive of software source code and versioncontrol system (VCS) development history.Using SwhFS  developers can quickly checkout  any of the 2 billion commits archived by Software Heritage  evenafter they disappear from their previous known location and without incurringthe performance cost of repository cloning. SwhFS works across unrelatedrepositories and different VCS technologies. Other source code artifactsarchived by Software Heritage-individual source code files and trees  releases and branches-can also be accessed using common programming tools and customscripts  as if they were locally available.A screencast of SwhFS is availableonline at dx.doi.org/10.5281/zenodo.4531411.
http://arxiv.org/abs/2102.06363, Multiversal views on language models,The virtuosity of language models like GPT-3 opens a new world of possibilityfor human-AI collaboration in writing. In this paper  we present a framework inwhich generative language models are conceptualized as multiverse generators.This framework also applies to human imagination and is core to how we read andwrite fiction. We call for exploration into this commonality through new formsof interfaces which allow humans to couple their imagination to AI to write explore  and understand non-linear fiction. We discuss the early insights wehave gained from actively pursuing this approach by developing and testing anovel multiversal GPT-3-assisted writing interface.
http://arxiv.org/abs/2102.06364, Complete Power Reallocation for MU-MIMO under Per-Antenna Power  Constraint,This paper proposes a beamforming method under a per-antenna power constraint(PAPC). Although many beamformer designs with the PAPC need to solve complexoptimization problems  the proposed complete power reallocation (CPR) methodcan generate beamformers with excellent performance only with linearoperations. CPR is designed to have a simple structure  making it highlyflexible and practical. In this paper  three CPR variations consideringalgorithm convergence speed  sum-rate maximization  and robustness to channeluncertainty are developed. Simulation results verify that CPR and itsvariations satisfy their design criteria  and  hence  CPR can be readilyutilized for various purposes.
http://arxiv.org/abs/2102.06365, White-Box Performance-Influence Models: A Profiling and Learning  Approach,Many modern software systems are highly configurable  allowing the user totune them for performance and more. Current performance modeling approaches aimat finding performance-optimal configurations by building performance models ina black-box manner. While these models provide accurate estimates  they cannotpinpoint causes of observed performance behavior to specific code regions. Thisdoes not only hinder system understanding  but it also complicates tracing theinfluence of configuration options to individual methods.We propose a white-box approach that models configuration-dependentperformance behavior at the method level. This allows us to predict theinfluence of configuration decisions on individual methods  supporting systemunderstanding and performance debugging. The approach consists of two steps:First  we use a coarse-grained profiler and learn performance-influence modelsfor all methods  potentially identifying some methods that are highlyconfiguration- and performance-sensitive  causing inaccurate predictions.Second  we re-measure these methods with a fine-grained profiler and learn moreaccurate models  at higher cost  though. By means of 9 real-world Java softwaresystems  we demonstrate that our approach can efficiently identifyconfiguration-relevant methods and learn accurate performance-influence models.
http://arxiv.org/abs/2102.06366, Well-posedness theory for nonlinear scalar conservation laws on networks,We consider nonlinear scalar conservation laws posed on a network. Weestablish  L^1  stability  and thus uniqueness  for weak solutions satisfyingthe entropy condition. We apply standard finite volume methods and showstability and convergence to the unique entropy solution  thus establishingexistence of a solution in the process. Both our existence andstability/uniqueness theory is centred around families of stationary states forthe equation. In one important case -- for monotone fluxes with an upwinddifference scheme -- we show that the set of (discrete) stationary solutions isindeed sufficiently large to suit our general theory. We demonstrate themethod's properties through several numerical experiments.
http://arxiv.org/abs/2102.06371, SceneRec: Scene-Based Graph Neural Networks for Recommender Systems,Collaborative filtering has been largely used to advance modern recommendersystems to predict user preference. A key component in collaborative filteringis representation learning  which aims to project users and items into a lowdimensional space to capture collaborative signals. However  the sceneinformation  which has effectively guided many recommendation tasks  is rarelyconsidered in existing collaborative filtering methods. To bridge this gap  wefocus on scene-based collaborative recommendation and propose a novelrepresentation model SceneRec. SceneRec formally defines a scene as a set ofpre-defined item categories that occur simultaneously in real-life situationsand creatively designs an item-category-scene hierarchical structure to build ascene-based graph. In the scene-based graph  we adopt graph neural networks tolearn scene-specific representation on each item node  which is furtheraggregated with latent representation learned from collaborative interactionsto make recommendations. We perform extensive experiments on real-worldE-commerce datasets and the results demonstrate the effectiveness of theproposed method.
http://arxiv.org/abs/2102.06377, Rate-Splitting Multiple Access to Mitigate the Curse of Mobility in  (Massive) MIMO Networks,Rate-Splitting Multiple Access (RSMA) is a flexible and robust multipleaccess scheme for downlink multi-antenna wireless networks. RSMA relies onmulti-antenna Rate-Splitting (RS) at the transmitter and SuccessiveInterference Cancellation (SIC) at the receivers. In this work  we study theperformance of RSMA under the practical important setup of imperfect ChannelState Information at Transmitter (CSIT) originating from user mobility andlatency in the network. First  we derive a lower bound on the ergodic sum-rateof RSMA for an arbitrary number of transmit antennas  number of users  userspeeds and transmit power. Then  we study the power allocation between commonand private streams and obtain a closed-form solution for the optimal powerallocation that maximizes the obtained lower bound. The proposed powerallocation greatly reduces precoder design complexity for RSMA. By Link-LevelSimulations (LLS)  we demonstrate that RSMA with the proposed power allocationis robust to degrading effects of user mobility and has significantly higherperformance compared to conventional multi-user (massive) Multiple-InputMultiple-Output (MIMO) strategies. The work has important practicalsignificance as results demonstrate that  in contrast to conventionalmulti-user (massive) MIMO whose performance collapse under mobility  RSMA canmaintain reliable multi-user connectivity in mobile deployments.
http://arxiv.org/abs/2102.06380, A Too-Good-to-be-True Prior to Reduce Shortcut Reliance,Despite their impressive performance in object recognition and other tasksunder standard testing conditions  deep convolutional neural networks (DCNNs)often fail to generalize to out-of-distribution (o.o.d.) samples. One cause forthis shortcoming is that modern architectures tend to rely on  shortcuts  -superficial features that correlate with categories without capturing deeperinvariants that hold across contexts. Real-world concepts often possess acomplex structure that can vary superficially across contexts  which can makethe most intuitive and promising solutions in one context not generalize toothers. One potential way to improve o.o.d. generalization is to assume simplesolutions are unlikely to be valid across contexts and downweight them  whichwe refer to as the too-good-to-be-true prior. We implement this inductive biasin a two-stage approach that uses predictions from a low-capacity network (LCN)to inform the training of a high-capacity network (HCN). Since the shallowarchitecture of the LCN can only learn surface relationships  which includesshortcuts  we downweight training items for the HCN that the LCN can master thereby encouraging the HCN to rely on deeper invariant features that shouldgeneralize broadly. Using a modified version of the CIFAR-10 dataset in whichwe introduced shortcuts  we found that the two-stage LCN-HCN approach reducedreliance on shortcuts and facilitated o.o.d. generalization.
http://arxiv.org/abs/2102.06384, Densely Deformable Efficient Salient Object Detection Network,Salient Object Detection (SOD) domain using RGB-D data has lately emergedwith some current models' adequately precise results. However  they haverestrained generalization abilities and intensive computational complexity. Inthis paper  inspired by the best background/foreground separation abilities ofdeformable convolutions  we employ them in our Densely Deformable Network(DDNet) to achieve efficient SOD. The salient regions from densely deformableconvolutions are further refined using transposed convolutions to optimallygenerate the saliency maps. Quantitative and qualitative evaluations using therecent SOD dataset against 22 competing techniques show our method's efficiencyand effectiveness. We also offer evaluation using our own createdcross-dataset  surveillance-SOD (S-SOD)  to check the trained models' validityin terms of their applicability in diverse scenarios. The results indicate thatthe current models have limited generalization potentials  demanding furtherresearch in this direction. Our code and new dataset will be publicly availableat https://github.com/tanveer-hussain/EfficientSOD
http://arxiv.org/abs/2102.06385, Supervised training of spiking neural networks for robust deployment on  mixed-signal neuromorphic processors,Mixed-signal analog/digital electronic circuits can emulate spiking neuronsand synapses with extremely high energy efficiency  following an approach knownas  neuromorphic engineering . However  analog circuits are sensitive tovariation in fabrication among transistors in a chip ( device mismatch ). Inthe case of neuromorphic implementation of Spiking Neural Networks (SNNs) mismatch is expressed as differences in effective parameters betweenidentically-configured neurons and synapses. Each fabricated chip thereforeprovides a different distribution of parameters such as time constants orsynaptic weights. Without the expensive overhead in terms of area and power ofextra on-chip learning or calibration circuits  device mismatch and other noisesources represent a critical challenge for the deployment of pre-trained neuralnetwork chips. Here we present a supervised learning approach that addressesthis challenge by maximizing robustness to mismatch and other common sources ofnoise.The proposed method trains (SNNs) to perform temporal classification tasks bymimicking a pre-trained dynamical system  using a local learning rule adaptedfrom non-linear control theory. We demonstrate the functionality of our modelon two tasks that require memory to perform successfully  and measure therobustness of our approach to several forms of noise and variability present inthe network. We show that our approach is more robust than several commonalternative approaches for training SNNs.Our method provides a viable way to robustly deploy pre-trained networks onmixed-signal neuromorphic hardware  without requiring per-device training orcalibration.
http://arxiv.org/abs/2102.06386, Robust Hybrid High-Order method on polytopal meshes with small faces,We design a Hybrid High-Order (HHO) scheme for the Poisson problem that isfully robust on polytopal meshes in the presence of small edges/faces. We stategeneral assumptions on the stabilisation terms involved in the scheme  underwhich optimal error estimates (in discrete and continuous energy norms  as wellas  L^2 -norm) are established with multiplicative constants that do not dependon the maximum number of faces in each element  or the relative size between anelement and its faces. We illustrate the error estimates through numericalsimulations in 2D and 3D on meshes designed by agglomeration techniques (suchmeshes naturally have elements with a very large numbers of faces  and verysmall faces).
http://arxiv.org/abs/2102.06387, Banana for scale: Gauging trends in academic interest by normalising  publication rates to common and innocuous keywords,Many academics use yearly publication numbers to quantify academic interestfor their research topic. While such visualisations are ubiquitous in grantapplications  manuscript introductions  and review articles  they fail toaccount for the rapid growth in scientific publications. As a result  anysearch term will likely show an increase in supposed  academic interest . Oneproposed solution is to normalise yearly publication rates by field size  butthis is arduous and difficult. Here  we propose an simpler index thatnormalises keywords of interest by a ubiquitous and innocuous keyword  such as banana . Alternatively  one could opt for field-specific keywords orhierarchical structures (e.g. PubMed's Medical Subject Headings  MeSH) tocompute  interest market share . Using this approach  we uncovered plausibletrends in academic interest in examples from the medical literature. Inneuroimaging  we found that not the supplementary motor area (as was previouslyclaimed)  but the prefrontal cortex is the most interesting part of the brain.In cancer research  we found a contemporary preference for cancers with highprevalence and clinical severity  and notable declines in interest for moretreatable or likely benign neoplasms. Finally  we found that interest inrespiratory viral infections spiked when strains showed potential for pandemicinvolvement  with SARS-CoV-2 and the COVID-19 pandemic being the most extremeexample. In sum  the time is ripe for a quick and easy method to quantifytrends in academic interest for anecdotal purposes. We provide such a method along with software for researchers looking to implement it in their ownwriting.
